Full Journal Title,JCR Abbreviated Title,Issn,Journal Impact Factor,5-Year Impact Factor,Category,Year
JOURNAL OF HIGH SPEED NETWORKS,J HIGH SPEED NETW,0926-6801,0.196,0.200,Information Systems,2008
JOURNAL OF INFORMATION SCIENCE AND ENGINEERING,J INF SCI ENG,1016-2364,0.242,0.397,Information Systems,2008
IET Information Security,IET INFORM SECUR,1751-8709,0.273,0.273,Information Systems,2008
JOURNAL OF COMMUNICATIONS AND NETWORKS,J COMMUN NETW-S KOR,1229-2370,0.273,0.402,Information Systems,2008
RAIRO-THEORETICAL INFORMATICS AND APPLICATIONS,RAIRO-THEOR INF APPL,0988-3754,0.277,0.434,Information Systems,2008
PROGRAM-ELECTRONIC LIBRARY AND INFORMATION SYSTEMS,PROGRAM-ELECTRON LIB,0033-0337,0.286,0.281,Information Systems,2008
INFOR,INFOR,0315-5986,0.324,0.590,Information Systems,2008
IEICE TRANSACTIONS ON INFORMATION AND SYSTEMS,IEICE T INF SYST,0916-8532,0.369,0.366,Information Systems,2008
PHOTONIC NETWORK COMMUNICATIONS,PHOTONIC NETW COMMUN,1387-974X,0.427,0.705,Information Systems,2008
JOURNAL OF RESEARCH AND PRACTICE IN INFORMATION TECHNOLOGY,J RES PRACT INF TECH,1443-458X,0.429,0.495,Information Systems,2008
IEICE TRANSACTIONS ON FUNDAMENTALS OF ELECTRONICS COMMUNICATIONS AND COMPUTER SCIENCES,IEICE T FUND ELECTR,0916-8508,0.437,0.444,Information Systems,2008
MULTIMEDIA TOOLS AND APPLICATIONS,MULTIMED TOOLS APPL,1380-7501,0.462,0.704,Information Systems,2008
BELL LABS TECHNICAL JOURNAL,BELL LABS TECH J,1089-7089,0.492,0.547,Information Systems,2008
ASLIB PROCEEDINGS,ASLIB PROC,0001-253X,0.493,0.462,Information Systems,2008
JOURNAL OF ORGANIZATIONAL COMPUTING AND ELECTRONIC COMMERCE,J ORG COMP ELECT COM,1091-9392,0.531,1.270,Information Systems,2008
WIRTSCHAFTSINFORMATIK,WIRTSCHAFTSINF,0937-6429,0.541,0.563,Information Systems,2008
Cluster Computing-The Journal of Networks Software Tools and Applications,CLUSTER COMPUT,1386-7857,0.591,Not Available,Information Systems,2008
COMPUTER COMMUNICATION REVIEW,COMPUT COMMUN REV,0146-4833,0.619,0.947,Information Systems,2008
SCIENCE IN CHINA SERIES F-INFORMATION SCIENCES,SCI CHINA SER F,1009-2757,0.664,0.711,Information Systems,2008
MULTIMEDIA SYSTEMS,MULTIMEDIA SYST,0942-4962,0.679,1.216,Information Systems,2008
Journal of Network and Systems Management,J NETW SYST MANAG,1064-7570,0.685,Not Available,Information Systems,2008
INFORMATION RETRIEVAL,INFORM RETRIEVAL,1386-4564,0.696,1.396,Information Systems,2008
INFORMATION TECHNOLOGY AND LIBRARIES,INFORM TECHNOL LIBR,0730-9295,0.703,0.549,Information Systems,2008
INFORMATION PROCESSING LETTERS,INFORM PROCESS LETT,0020-0190,0.706,0.907,Information Systems,2008
INFORMATION SYSTEMS FRONTIERS,INFORM SYST FRONT,1387-3326,0.706,0.781,Information Systems,2008
INTERNATIONAL JOURNAL OF COOPERATIVE INFORMATION SYSTEMS,INT J COOP INF SYST,0218-8430,0.714,1.585,Information Systems,2008
International Journal of Distributed Sensor Networks,INT J DISTRIB SENS N,1550-1329,0.722,0.930,Information Systems,2008
INFORMATICA,INFORMATICA-LITHUAN,0868-4952,0.734,0.914,Information Systems,2008
JOURNAL OF VLSI SIGNAL PROCESSING SYSTEMS FOR SIGNAL IMAGE AND VIDEO TECHNOLOGY,J VLSI SIG PROC SYST,0922-5773,0.779,0.761,Information Systems,2008
ACTA INFORMATICA,ACTA INFORM,0001-5903,0.789,1.046,Information Systems,2008
Internet Research,INTERNET RES,1066-2243,0.800,1.157,Information Systems,2008
Personal and Ubiquitous Computing,PERS UBIQUIT COMPUT,1617-4909,0.865,Not Available,Information Systems,2008
DISTRIBUTED AND PARALLEL DATABASES,DISTRIB PARALLEL DAT,0926-8782,0.875,2.461,Information Systems,2008
COMPUTER COMMUNICATIONS,COMPUT COMMUN,0140-3664,0.884,1.005,Information Systems,2008
WIRELESS COMMUNICATIONS & MOBILE COMPUTING,WIREL COMMUN MOB COM,1530-8669,0.909,2.329,Information Systems,2008
MEDICAL INFORMATICS AND THE INTERNET IN MEDICINE,MED INFORM INTERNET,1463-9238,0.922,1.025,Information Systems,2008
Journal of Optical Networking,J OPT NETW,1536-5379,0.941,Not Available,Information Systems,2008
INTERNATIONAL JOURNAL OF INFORMATION TECHNOLOGY & DECISION MAKING,INT J INF TECH DECIS,0219-6220,0.953,Not Available,Information Systems,2008
Digital Investigation,DIGIT INVEST,1742-2876,0.961,Not Available,Information Systems,2008
COMPUTER JOURNAL,COMPUT J,0010-4620,1.000,1.023,Information Systems,2008
IEEE SECURITY & PRIVACY,IEEE SECUR PRIV,1540-7993,1.000,Not Available,Information Systems,2008
WORLD WIDE WEB-INTERNET AND WEB INFORMATION SYSTEMS,WORLD WIDE WEB,1386-145X,1.000,1.189,Information Systems,2008
COMPUTERS & SECURITY,COMPUT SECUR,0167-4048,1.028,1.243,Information Systems,2008
METHODS OF INFORMATION IN MEDICINE,METHOD INFORM MED,0026-1270,1.057,1.155,Information Systems,2008
JOURNAL OF INTELLIGENT INFORMATION SYSTEMS,J INTELL INF SYST,0925-9902,1.075,1.410,Information Systems,2008
GEOINFORMATICA,GEOINFORMATICA,1384-6175,1.098,1.314,Information Systems,2008
ONLINE INFORMATION REVIEW,ONLINE INFORM REV,1468-4527,1.103,0.961,Information Systems,2008
Electronic Commerce Research and Applications,ELECTRON COMMER R A,1567-4223,1.130,Not Available,Information Systems,2008
OPEN SYSTEMS & INFORMATION DYNAMICS,OPEN SYST INF DYN,1230-1612,1.130,1.031,Information Systems,2008
WIRELESS NETWORKS,WIREL NETW,1022-0038,1.194,2.040,Information Systems,2008
INFORMATION AND SOFTWARE TECHNOLOGY,INFORM SOFTWARE TECH,0950-5849,1.200,1.148,Information Systems,2008
International Journal of Web Services Research,INT J WEB SERV RES,1545-7362,1.200,Not Available,Information Systems,2008
EUROPEAN JOURNAL OF INFORMATION SYSTEMS,EUR J INFORM SYST,0960-085X,1.202,1.482,Information Systems,2008
INFORMATION SYSTEMS MANAGEMENT,INFORM SYST MANAGE,1058-0530,1.242,1.383,Information Systems,2008
Computer Networks,COMPUT NETW,1389-1286,1.304,1.804,Information Systems,2008
JOURNAL OF VISUAL COMMUNICATION AND IMAGE REPRESENTATION,J VIS COMMUN IMAGE R,1047-3203,1.342,1.376,Information Systems,2008
ACM TRANSACTIONS ON INFORMATION SYSTEMS,ACM T INFORM SYST,1046-8188,1.472,6.306,Information Systems,2008
DATA & KNOWLEDGE ENGINEERING,DATA KNOWL ENG,0169-023X,1.480,1.863,Information Systems,2008
JOURNAL OF STRATEGIC INFORMATION SYSTEMS,J STRATEGIC INF SYST,0963-8687,1.484,2.012,Information Systems,2008
INTERNATIONAL JOURNAL OF GEOGRAPHICAL INFORMATION SCIENCE,INT J GEOGR INF SCI,1365-8816,1.596,2.293,Information Systems,2008
ACM TRANSACTIONS ON DATABASE SYSTEMS,ACM T DATABASE SYST,0362-5915,1.613,3.651,Information Systems,2008
MOBILE NETWORKS & APPLICATIONS,MOBILE NETW APPL,1383-469X,1.619,1.871,Information Systems,2008
SIGMOD RECORD,SIGMOD REC,0163-5808,1.620,2.607,Information Systems,2008
REQUIREMENTS ENGINEERING,REQUIR ENG,0947-3602,1.625,Not Available,Information Systems,2008
JOURNAL OF INFORMATION SCIENCE,J INF SCI,0165-5515,1.648,1.351,Information Systems,2008
INFORMATION SYSTEMS,INFORM SYST,0306-4379,1.660,2.261,Information Systems,2008
KNOWLEDGE AND INFORMATION SYSTEMS,KNOWL INF SYST,0219-1377,1.733,Not Available,Information Systems,2008
Journal of the Association for Information Systems,J ASSOC INF SYST,1536-9323,1.836,Not Available,Information Systems,2008
INFORMATION PROCESSING & MANAGEMENT,INFORM PROCESS MANAG,0306-4573,1.852,2.020,Information Systems,2008
DECISION SUPPORT SYSTEMS,DECIS SUPPORT SYST,0167-9236,1.873,2.276,Information Systems,2008
IBM SYSTEMS JOURNAL,IBM SYST J,0018-8670,1.883,2.124,Information Systems,2008
International Journal on Semantic Web and Information Systems,INT J SEMANT WEB INF,1552-6283,1.893,Not Available,Information Systems,2008
IEEE TRANSACTIONS ON INFORMATION TECHNOLOGY IN BIOMEDICINE,IEEE T INF TECHNOL B,1089-7771,1.939,2.825,Information Systems,2008
JOURNAL OF THE AMERICAN SOCIETY FOR INFORMATION SCIENCE AND TECHNOLOGY,J AM SOC INF SCI TEC,1532-2882,1.954,2.178,Information Systems,2008
JOURNAL OF INFORMATION TECHNOLOGY,J INF TECHNOL,0268-3962,1.966,3.097,Information Systems,2008
JOURNAL OF DATABASE MANAGEMENT,J DATABASE MANAGE,1063-8016,2.000,Not Available,Information Systems,2008
IEEE Transactions on Dependable and Secure Computing,IEEE T DEPEND SECURE,1545-5971,2.093,3.896,Information Systems,2008
IEEE TRANSACTIONS ON KNOWLEDGE AND DATA ENGINEERING,IEEE T KNOWL DATA EN,1041-4347,2.236,3.585,Information Systems,2008
IEEE MULTIMEDIA,IEEE MULTIMEDIA,1070-986X,2.258,2.189,Information Systems,2008
IEEE TRANSACTIONS ON MULTIMEDIA,IEEE T MULTIMEDIA,1520-9210,2.288,2.932,Information Systems,2008
JOURNAL OF THE ACM,J ACM,0004-5411,2.339,3.444,Information Systems,2008
INFORMATION & MANAGEMENT,INFORM MANAGE-AMSTER,0378-7206,2.358,4.079,Information Systems,2008
JOURNAL OF MANAGEMENT INFORMATION SYSTEMS,J MANAGE INFORM SYST,0742-1222,2.358,3.760,Information Systems,2008
DATA MINING AND KNOWLEDGE DISCOVERY,DATA MIN KNOWL DISC,1384-5810,2.421,3.803,Information Systems,2008
ACM Transactions on Multimedia Computing Communications and Applications,ACM T MULTIM COMPUT,1551-6857,2.465,Not Available,Information Systems,2008
ANNUAL REVIEW OF INFORMATION SCIENCE AND TECHNOLOGY,ANNU REV INFORM SCI,0066-4200,2.500,2.954,Information Systems,2008
IEEE PERVASIVE COMPUTING,IEEE PERVAS COMPUT,1536-1268,2.615,4.159,Information Systems,2008
INTERNATIONAL JOURNAL OF MEDICAL INFORMATICS,INT J MED INFORM,1386-5056,2.754,2.425,Information Systems,2008
Journal of Web Semantics,J WEB SEMANT,1570-8268,3.023,Not Available,Information Systems,2008
IEEE NETWORK,IEEE NETWORK,0890-8044,3.068,4.422,Information Systems,2008
INFORMATION SCIENCES,INFORM SCIENCES,0020-0255,3.095,2.846,Information Systems,2008
IEEE WIRELESS COMMUNICATIONS,IEEE WIREL COMMUN,1536-1284,3.180,5.935,Information Systems,2008
IEEE TRANSACTIONS ON MOBILE COMPUTING,IEEE T MOBILE COMPUT,1536-1233,3.352,5.021,Information Systems,2008
JOURNAL OF THE AMERICAN MEDICAL INFORMATICS ASSOCIATION,J AM MED INFORM ASSN,1067-5027,3.428,3.886,Information Systems,2008
Journal of Chemical Information and Modeling,J CHEM INF MODEL,1549-9596,3.643,3.528,Information Systems,2008
IEEE TRANSACTIONS ON INFORMATION THEORY,IEEE T INFORM THEORY,0018-9448,3.793,5.434,Information Systems,2008
MIS QUARTERLY,MIS QUART,0276-7783,5.183,11.586,Information Systems,2008
VLDB JOURNAL,VLDB J,1066-8888,7.067,9.473,Information Systems,2008
Journal of Signal Processing Systems for Signal Image and Video Technology,J SIGNAL PROCESS SYS,1939-8018,Not Available,Not Available,Information Systems,2008
